3fd093213d44b36ada1c79f56d8d9b57ec1de2c8	2024-03-26	Set windowOptOutEdgeToEdgeEnforcement for ControlsActivity
551c1432349b15e98b8ac05107c68dea6f5368d4	2024-03-26	Fix NPE
56854d40452d0b5bc9419de5d74e89f8724ef182	2024-03-18	Use resolved bounds in CompatDisplayInsets if letterboxed for aspect ratio
fd5c17bee1eb0fe40094c5ec38db9086ee54ed74	2024-02-19	HDMI: Change on active source lost behavior [1/2]
ffbe9543d74665595401be61f7a1ad71612c5ed0	2024-02-09	DISALLOW_RUN_IN_BACKGROUND works for profiles
c02a80193b84b5aad553f4eda485d62a8904f365	2024-03-26	Add a Framework unit test to mock gmail crash.
43a959d9377f429aa01b45e05f6cb4f022f30ea3	2024-03-26	Revert "Fix crash due to inconsistent handling of CR"
1f31bb181fc56f3deab5ce0d199220404991c438	2023-12-14	[CDM][CMD] Check permissions for CDM shell commands
d2a8b98233360e26bc18e4f5ed7a931f86dd4c34	2024-03-25	Updates DeviceState to use specific parcel methods
ce3473c72cbbb7b641acf704f03c1373690e5c2e	2024-03-18	Sony DualShock 4: disable drumroll detection by speed change
5843daa8af0a05344e8594be071defbe7f1ab44c	2024-03-18	Sony DualShock 4: disable palm edge zones
73a5d1b258faf786b743ff16ac49bd4202b0e3c9	2024-03-19	Sony DualShock 4: disable drumroll suppression
d05ece78af488d74a0a6bb583648cf7f98c0c1f3	2024-03-15	Revert^3 "Keystore: Validate curve names in XDH and ED25519"
21eaf54da9cc7e572d4d31c2c625f565eb2f499f	2024-03-19	Handle move to fullscreen from split screen from request fullscreen API
4da1d0efcb5262c3dbfc793d5e718b03c77ce62d	2024-03-26	Update the Resources owners
5ffce6346e8ab6635514e1fc4b2d493dfce75936	2024-03-18	Remove Meta+T shortcut
9829a16df0a3da04ab017787e5382449e22cddbf	2024-03-12	Set callback to the PackageImpl if creates via a Parcel
a8a4b9893831ba9981894e05067385c36fcfd8b6	2024-03-27	Revert "Extracting LightSensorController from ABC"
b61895f4a268a350dccfab8bdb1d8bc9d149f7c3	2024-03-27	Revert "Extracting LightSensorController from ABC"
c160424ef22bffd25a9cc9bc7b901ae1b9721a72	2024-03-18	[PM] Send ACTION_PACKAGE_CHANGED when mimeGroups are changed
986be5b53bbc274eea2b38a8d6c4a040cc0cc7da	2024-03-18	[PM] Send ACTION_PACKAGE_CHANGED when mimeGroups are changed
fc7842aa217d4f13a8638933db1eb2d32b966882	2024-03-18	[PM] Send ACTION_PACKAGE_CHANGED when mimeGroups are changed
6d9520bb9be2e31fd43bb08f0017838bbd389883	2024-03-18	[PM] Send ACTION_PACKAGE_CHANGED when mimeGroups are changed
4217415dbe8e83ba4c8bf56ac6ff21523187f59f	2024-03-18	[PM] Send ACTION_PACKAGE_CHANGED when mimeGroups are changed
0f3f78fc0ec5df6061566ee1e16d913aa4d7ca88	2024-03-13	Add extra checks in isReadyToShowIme
d8451a7448058baf0383d9674127e1475727431a	2024-03-20	Clear calling identity before call to UserManagerService
99666c09ae5c31ec8557312f0ccecb45189a52a2	2024-03-18	[RESTRICT AUTOMERGE][PM] Send ACTION_PACKAGE_CHANGED when mimeGroups are changed
0c83491b22258b6edc4c38aa24b1b19038d35d73	2024-03-18	[RESTRICT AUTOMERGE][PM] Send ACTION_PACKAGE_CHANGED when mimeGroups are changed
b561f0ac31de9f48ece7493cfb5c559844c97ff5	2024-03-27	Clear IME back callbacks when IME is killed
738ccd74e79771b58e5c4bfef3d5409301e49ef2	2024-03-27	Add SystemUI folks as owners of testables
5e50b562a4555c8dbc69c990ccd40094bdab5c07	2024-03-27	Make BackAnimationSpec respect DisplayMetrics changes
d4edc1d0cf35638053ea22e3dcfb9a0342e74498	2024-03-26	Allows fallback to matching by name for older kernels without UNIQ.
2cab7c5be9399f48ba474095a8f3a948acd08bdd	2024-03-27	Don't inject the context into KeyguardUnlockAnimationController
17c240ccffb7e7157919e94265ce53680bfc8144	2024-03-19	CallStyle: Handle null icon to glue
8f14e1a1f31329aafeb5161e7c6c5dfa8ef74767	2024-03-19	CallStyle: Also handle null label to glue
90458569bb8c14ddb5a8d4b8df0af5d9bbc7c362	2024-03-22	CallStyle: don't reglue icon+label if never glued
fcdae5b911984555888253804e11e096f084d3d8	2024-03-22	Revert "Update the enabled state with the current user state"
d012e7c2a50dc20688c12e0c6d8521c4dcfa2c4e	2024-03-26	DMD fix flicker vote
7ed9aea803de92a7e409e03c170f9190b0793f0e	2024-03-27	Fix RemoteInputView not visible when Reply tapped from AOD
86ce704831ef14fa6b0c7a6e0399a125de159e05	2024-03-27	Fix NPE & spline error
bac848b974f05ac6b2e1c9e84730c74375c5ab49	2024-03-25	Change quickaccess tile logic for when the wallet role is available and support Wallet Role being None.
e1abd97c4dcfe04124aef43e41e52477b2493a64	2024-03-27	Transfer large bitmaps as a byte array
75584ff6da827aa0ed13d1da2b3b3d44d12da977	2024-03-18	[flexiglass] Occlusion support.
500a2bb4b538331a89d6ca2ffe34c477f9ab1426	2024-03-22	Fix Amazon Prime Video sign in failure caused by register_resource_paths feature flag.
8a49392bace8369fe7b3716372c2cfa7d04b96b2	2024-03-06	Update alarm data on main thread
81d3081baea77df17e7c2aee963e157225fa490d	2024-03-19	Revert "Make Navbar Secondary Handle Appear Correctly"
1c1de947972d125db81c5aaac28ca4b8b9f234eb	2024-03-28	Fixes NullPointerException
4a6a6fa466fcf5eb291bafca2ded8bab992720a6	2024-03-18	Sony DualShock 4: disable drumroll detection by speed change
e18b2958b09a12ce8b441a6c06c95af8f5366435	2024-03-19	CallStyle: Handle null icon to glue
914ad469ecfafcbd683a31601117d35e0deaa105	2024-03-22	Revert "Update the enabled state with the current user state"
6f086b0645393487236b8b5db6c82899288819ef	2024-03-27	Fix RemoteInputView not visible when Reply tapped from AOD
d947cc68a9ba922b90df54d13d5f9f6514ce93fa	2024-03-26	DMD fix flicker vote
9b772df2a5ae9db5cf67f2354a34f592953eab72	2024-03-28	Fix the memory leak caused by the accessibility menu in SystemUI
74f313c9a993f156f1c7929a0a97bf335479608d	2024-03-21	Ensure that MEDIA_PROJECTION_STATE_CANCELLED is only emitted when actually cancelling set up
baf5bdcfb917e163dfa14b90054401d61253229c	2024-03-26	Add support for TransitionKey in glanceable hub
51c6761d121ceb8881341e3ab13898f50b204955	2024-03-27	Ensure security log broadcast is sent to the correct user on Headless.
227ef4143a55567254c2627955c6ab680302e74a	2024-03-28	Properly hide notifications when glanceable hub is showing
bf425e08d7ac9fc3e3ffc4834ed99d36dac13e18	2024-03-28	Revert "Use resolved bounds in CompatDisplayInsets if letterboxed for aspect ratio"
ddd79371584a8858929b8fb994c3930db3914ad9	2024-03-28	Ignore keyguard transitions FROM an invalid state.
96e8b05123f5dabf2eb5a43f4a5b892a1ada3a1c	2024-03-26	Fix hub touch handling interfering with bouncer swipe on dream
fde6406e8dfd50ee22ca4d1eff6d2e06846a9e49	2024-03-28	Implement auto-enter PiP2 in gesture nav [5/N]
9adee2ac4237da7795860d29504e721f6d9db8e9	2024-03-20	[Networking] Use SharingStarted.Eagerly for broadcast
4f228c305d26ffba649565e780892e1963881039	2024-03-19	Prevent pilfering of resize events.
8fa78edeacf5107439a40696f3bfb641ad3813fa	2024-03-28	Fix null pointer exception during device entry
39e4711d3ddda73afef5f71690cb300c4595583b	2024-03-26	Update SAW exemption for user-initiated jobs.
1a1d8f04cb2157e6be11dd286e9846a0e2fe7b6a	2024-03-29	Update the new SYSTEM_ALERT_WINDOW check for FGS.
ee2a26ff7ab4e143b8d0f4b197c527cad305ea75	2024-03-26	Do not report ActivityWindowInfo from invisible Activity window
34ad507bfebd5a65bde5858fe760c58bd1a665eb	2024-03-18	Hide shortcut helper on all apps
3886b25e8c115a4dc3e7511de75cce2d1581d834	2024-03-29	Avoid a potential ArrayIndexOutOfBoundsException
1c7a0d348459ca437c72e928c5ac5540a7d70ada	2024-03-20	[Networking] Use SharingStarted.Eagerly for broadcast
167eeea91ce62c8a83db6ed9d3a06f3d8e192896	2024-03-19	Sort notifs chronologically within a section
25a0eddc1f4dd253b02446060fd9c6e95b0cd1b5	2024-03-28	Add SATELLITE_COMMUNICATION to Settings app
9fb69ff266c6d143a62b3ffddf5119afaabaac4f	2024-03-28	Adding "android.software.contextualsearch" to FEATURES in PackageManager.
3328735dc887d50a52e35da1f6e37266c33fc20e	2024-03-26	Import translations. DO NOT MERGE ANYWHERE
8f699f33139ccb325dc95f9e408193727c4e2ec4	2024-03-26	Import translations. DO NOT MERGE ANYWHERE
916e15035cf19575a547d3c19439ccef24857c5f	2024-03-26	Import translations. DO NOT MERGE ANYWHERE
aa7b6357277d4b45fdcd49c11666d98399baf087	2024-03-26	Import translations. DO NOT MERGE ANYWHERE
bb4b18b6ccda55014b2d4a53fcaf924f40649e8f	2024-03-26	Import translations. DO NOT MERGE ANYWHERE
b480677cdf85bda425351df25bc6e5962902e998	2024-03-26	Import translations. DO NOT MERGE ANYWHERE
627bb0bc8a6d5182c39ec9fdbc98c5a2a4a8aed6	2024-03-26	Import translations. DO NOT MERGE ANYWHERE
191fa45d19a1bf1b3dc5b142cd4ad6ef5a793529	2024-03-26	Import translations. DO NOT MERGE ANYWHERE
449b7333135eacfe6824dc18c53e575000d4da66	2024-03-26	Import translations. DO NOT MERGE ANYWHERE
dd034ad8a8e65ca3a044e9429a77e1d3c412ff90	2024-03-26	Import translations. DO NOT MERGE ANYWHERE
aaebe95787daea0e78181381d90b9fb46e6fa8fe	2024-03-26	Import translations. DO NOT MERGE ANYWHERE
3c4f5273ea8231bd6be67391a7ae7d2852a35ec9	2024-02-13	Add RootTargetPreparer for explicitly specifying the root dependency
d53f755151fb38b26a5b8c04a7a24e7ab01152ad	2024-03-25	Don't allow to create a window in an unassigned display.
1b8878fa870b4986314595838b653a6151a8924a	2024-03-29	More stabilize predictive back animation.
177ed9063e484549e8fee765b21d1a3677072957	2024-03-26	Introduce new legacy size test case
3ba3874e4a563f63522166c6d5b1b969077fb3c8	2024-03-13	[DO NOT MERGE][Autofill Framework] Add in check for intent filter when setting/updating service
bedc0ff2bfa8c5faf336ba5e87d80b3a85fde53d	2024-03-13	[DO NOT MERGE][Autofill Framework] Add in check for intent filter when setting/updating service
51d64705ab70788a536c26d4df5e63f0952ec98f	2024-03-13	[DO NOT MERGE][Autofill Framework] Add in check for intent filter when setting/updating service
37c2b0112e34078bbb7f4a537e35fa51af110c2e	2024-03-13	[DO NOT MERGE][Autofill Framework] Add in check for intent filter when setting/updating service
e8a448f855ef6ba9ae4b655e6824631f8023c0a0	2024-03-13	[DO NOT MERGE][Autofill Framework] Add in check for intent filter when setting/updating service
ee20adb4b4b2065e040167a4354c4fabaf06e35d	2024-03-13	[DO NOT MERGE][Autofill Framework] Add in check for intent filter when setting/updating service
b59fa891858c51480b387e24ae03a9b55b3e30a6	2024-03-13	[DO NOT MERGE][Autofill Framework] Add in check for intent filter when setting/updating service
a5d7857df0ecccb33ce74a52def4fa4c12e36e9b	2024-03-22	Use consistent helper class for keystore authorization
77479f42d00bce89f0998bd09bf289e89f7654ad	2024-04-01	Restore squashing permission for size test parcel
5c0e77d8178a33eece898e187d076eb8ba06137f	2024-03-28	Rollforward aslgen tests and more fields, fixing tests.
a66bca9b494a909e7936f42044499ab2789060bb	2024-04-01	Ensure account info logged doesn't expose user data.
63efc310dcc46fc4971e14f2ab6bbc0b4ed57cb5	2024-03-26	Restore bounds when returning from maximized window bounds
75471bc4e6a09e9444297e9a8e2f7bc19d8be1e8	2024-04-01	Disable hover view cache in handwriting initiator
bd438e2e7d952bc5fa2316053a86c5bd7bd08f35	2024-04-02	Add SATELLITE_COMMUNICATION to Settings app
aff051cde630665e11c75f6fca8bccfa8c11a721	2024-03-22	PSS: permission dialog - add default option as constructor parameter
b564659271df5cfbc87e153c65dd2103811e6684	2024-04-02	PSS: use material spec colors for permission dialog popup
f61fae159d1a48ee8af6728fb1698b9b4efe36db	2024-04-02	Updating ownership of color resources
95ebdf396a67f686429ba6fd326caba70a59d3b3	2024-04-02	Fixing NPE before calling unbind
bc00016048a941d101f68e8825fe0307880bad5a	2024-04-02	Return Color.TRANSPARENT from getNavigationBarColor
ade1f883d7d2283d7de0169c5062381619ff4ae2	2024-04-02	Revert "Updating ownership of color resources"
d39324cdebfc03521fd0f63a877c998362dd7619	2024-03-22	Start using the exported flag in permission module
b71891cb91b7aa54cc079e5bdfab701f4a18b49b	2024-02-27	Intercept key up after handling Ctrl+space
70fcfaacece2d1a71a69571b50be9757dc3af8e6	2024-04-02	Revert "[Mobile] Make sure we +1 the reported level if INFLATE_SIGNAL_STRENGTH is true"
07cc5b73b870fb96896d95a67a036ff88362ba20	2024-03-30	Let light bar state be able to be read by insets API
6162b9de54076713e622b2749c1296c0ac62974a	2024-04-02	[Battery] Improve contrasts
8a1346ce7aa21c8294a0eb8214fdf55149afa246	2024-03-21	[DO NOT MERGE][CDM] Fix a security issue that allow 3p apps to skip prompt by setSkipPrompt
804f5a83a6b4866d137863954b831c9c68d76693	2024-04-02	Revert "[Mobile] Make sure we +1 the reported level if INFLATE_SIGNAL_STRENGTH is true"
f28e88e53d57779fff5900d1811ffa07ab174640	2024-03-21	[DO NOT MERGE][CDM] Fix a security issue that allow 3p apps to skip prompt by setSkipPrompt
37acf9d15d26a5feca45d835c34ea41b49d2d86d	2024-04-02	Update API docs for ACTION_NEW_OUTGOING_CALL broadcast.
e1feb6b026796503cce2d58a2229eb18170e73df	2024-04-02	Use provided UID for checking Carrier Privileges
dafa45174601930e07879e7114cc2e44b0d15ed8	2024-03-20	Combine bounds change and move-to-center animations.
2be4886da1f3bbcfa78e939c37ef49916d7e3a4a	2024-04-01	Fix AvalancheController.update NPE when HeadsUpEntry is null
3c6a28b980c5735d05460cfdf773dcbcf08c6a62	2024-03-27	Perform device capability check when checking device aware permission on remote devices
f8299175a7162ef813ab09a300eafc442edcd1c0	2024-04-03	Ignore APEX packages in UPS (i.e. in V+).
c30012d46c83ee2685981d01540fb1df30c37f5d	2024-04-02	Revert "[Mobile] Make sure we +1 the reported level if INFLATE_SIGNAL_STRENGTH is true"
1dfa671003ae4e080886ee1485f2997d65e0ecce	2024-04-03	Revert "Return the size of the buffer for validation"
da0d6ea51b2f2001a82188f37b15f9d09db47ddc	2024-04-02	Add util methods to validate satellite config data
d5860a2125df627335bca24d22925a18e830b4a2	2024-04-02	[Media Projection] Use plain AlertDialog for 3rd party hosts instead of SystemUIDialog
c53b4917df173cb912f4fcbc907fef8c20f3cf75	2024-04-02	Make sure we delete a gloabl instead of a weak global reference to the java data source
10952b0ffdc7e33eba6626f5796fe0d47acc0b3a	2024-04-03	Revert "Perform device capability check when checking device aware permission on"
d3e5441541a35617b8b0e1d317290e26cfc71eeb	2024-04-01	Fix NPE crash from scheduleAnimation after cancelPendingAnimation.
11b8f124907dce91df8335225103ea3530e35cd7	2024-04-03	Updating ownership of color resources
209c4090acff2a73a053a47ed940c36e84b53f76	2024-03-18	Sony DualShock 4: disable palm edge zones
025274030c9f040e999dd13ca239ddb9f076d277	2024-03-19	Sony DualShock 4: disable drumroll suppression
cd7ae4411651bd22a34abffd0cca52e180791952	2024-02-26	PSS opt-out override: move logic to MediaProjectionManager
2a82b416c2079e2ce27d67986d67c5daeb70c9dc	2024-03-20	Remove dependencies on legacy keyguard state for the isUnlocked state
074972fd564767bb997341eb3ed7061a4885ec7c	2024-04-02	Add bubbles API to update bubble bar bounds
f988642e94265833c16d33b2b8f7f02923b37952	2024-04-03	Fix NPE in zeroJankProxy resultReceiver
9d07aafe72d67be3ba5d7555eca6ad2ce47d921e	2024-04-03	Allow certain KeyEvents to bypass falsing
437699381dea4d1b79b9fb7e2acb301167b6607d	2024-04-03	Revert^2 "Perform device capability check when checking device aware permission on"
54c968aaa66e9364bc0380c9a57af5c6844759aa	2023-12-14	[CDM][CMD] Check permissions for CDM shell commands
bbc53d0f8e2f08d1317485671a0ee224cfc69422	2024-04-01	Update CUJ_SCREEN_OFF_SHOW_AOD to use new clockId source
8ad161c7baf60cc516131ff642b845866c2724e2	2024-03-19	[omni] Make LPH duration and touch slop dynamically configured.
7888c5daa7e4c16a9dec6e1870c147031c34defb	2024-01-30	Delete the permission given egress data permission is cancelled. Bug: 287084170 Test: presubmit
835a35fc9044997b976ac2fa8a7b8727490de2fb	2024-04-03	[1/2] Add relevant tests in VDM to presubmit test of permission code
8aef5589a0125423c3cf648b7771579fa21c8ef6	2024-03-24	[flexiglass] Notification composables now set the particular placeholder values from the right place.
6611214157b2e4dce57859626519972383623421	2024-03-28	[flexiglass] Use null bounds to disable the clipping in the NSSL.
f20473553bd83cfe30bdddf4b1960002af18ab4c	2023-12-14	[CDM][CMD] Check permissions for CDM shell commands
a4ac6b82cb8c14b0490f3745217cb5c64ba01232	2024-04-02	Split callback registration and route scanning in InfoMediaManager
ddbcecbbf3b9913e59bfe6302f21a9741d331477	2024-04-04	Avoid any NPE in ImageWallpaper#onDestroy
3620736b153a8ef2121d782fa7923479ce531c9d	2024-04-04	Check if `mDragResizeListener` is null before use in `DesktopModeWindowDecoration`
1ae3b43c248cdf5ee63311f06acd0ee19d93f0cd	2023-12-14	[CDM][CMD] Check permissions for CDM shell commands
894439e4d6a764c79c5dd80cf0639865c872cbd9	2024-04-04	Remove kwekua@google.com from apex/jobscheduler/framework/java/android/app/job/OWNERS
0c46ffad24b9cce2ba647089a6719ec6d18699c9	2024-04-04	Remove kwekua@google.com from apex/jobscheduler/service/java/com/android/server/tare/OWNERS
d18052c7e654fa04f28d6e39089f649f2a48ca62	2024-04-04	Remove kwekua@google.com from cmds/incident_helper/OWNERS
72f2f9d8ea148107ddb86b94da86027d84c02e20	2024-04-04	Remove kwekua@google.com from core/proto/OWNERS
16f86b529ae1fbf1f57ef205c7c5b2bd236a45b0	2024-04-04	Remove kwekua@google.com from services/core/java/com/android/server/am/OWNERS
a431de0b4027d69818e637aa0a0f48a27d1c44a1	2024-04-04	Remove kwekua@google.com from services/core/java/com/android/server/power/batterysaver/OWNERS
9c85945f821f324d29f1c25349aa304b29788f9d	2024-04-04	Remove kwekua@google.com from services/core/java/com/android/server/utils/quota/OWNERS
0624a5c15b939d3a5f76c81c4f8ee7339c4b95b7	2024-04-04	Remove kwekua@google.com from apex/jobscheduler/OWNERS
efd4d6feef177ce7f488c081933b802e9c2ee46f	2024-04-04	Fix metro clock animation triggers twice when going to AOD
b2f07fe729de24c9d705f5768826e29414439c6a	2024-03-26	Allow resource override for PiP size spec
63d699245f19338d63f320d2b80b4a3bcbd7ae21	2024-04-04	Don't cancel PendingIntents unless the stay_stopped flag is on.
8d5a06f1466dcda77f9b474bc19b508fbe6266cb	2024-03-26	Allow resource override for PiP size spec
5d28b2ec050f46fdcad9ec1c77150f4f25fc8d70	2024-04-04	Fix the activity leak issue
eb68b0d423afb55159b1c02b0897f597c0905916	2023-12-14	[CDM][CMD] Check permissions for CDM shell commands
ff7ecf81c4b166dbdad8924ae962f58651160fff	2024-04-05	Allow adoptedshell to use low sdk bypass flag
8220b5124a4288383ed32f0405ce1b677358acb6	2024-04-05	Add a hostside library for permissions flags
14d57fdda009d46c894a2ec80f529ef4f39b0c54	2024-03-27	Explicitly reference system services where possible
76be2ad85cd33d929357a121192e609a158960a7	2024-03-27	Explicitly reference system services where possible (2)
3498736deb1c6418fb80164acc93fd07b5870549	2024-04-05	Fix incorrect expectation about usage of bounds
6b37e0928dd8d846abcfee9bc06c2ceaea42d749	2024-04-05	Revert "Revert^2 "Prevent attaching navWindow to large screen de..."
f3f7057dde090f2008ca39ee352083ce557de318	2024-04-05	[pm] skip the second user confirmation for unarchive with REQUEST_INSTALL_PACKAGES
2b02b53e8557a7b1fe08ab6ec8e79e79a5d7f273	2023-12-14	[CDM][CMD] Check permissions for CDM shell commands
8d008c61451dba86aa9f14c6bcd661db2cea4856	2023-12-14	[CDM][CMD] Check permissions for CDM shell commands
f27ffc65f25eb9acee4a0e5f8a273f763fb2b82e	2024-03-04	Enforce strong auth for private profile on storage lock events
617181cb398a15667555db1f05218cfb0f85f979	2024-04-08	Accept MODE_DEFAULT for ACCESS_NOTIFICATIONS
0d00031851e9f5d8ef93947205a7e8b5257f0d8d	2024-03-21	Delete keystore keys from RecoveryService.rebootRecoveryWithCommand()
4426de38dd5d622151d54aaa02b8b28c7df5458b	2024-03-12	Fix allowlist token issues
d0cc94af61991a42b605f2f1e65481837e786bce	2024-04-08	PSS Override
5d9da3922fd11e1335c16d04515b1bcb9d979dcc	2024-04-08	Fix displayIdMirror test
58f7d34bfe90cf78f37f0e776a423924c86ca4d9	2024-04-03	aslgen implement security labels and third party verification
eaa90ee7a25d999ac5d0682017d81fde2bdc3863	2024-04-08	Fallback to endRelOffset for activity surface offsets
fef145755fb153bd38f199dbda0e8a442e5d5158	2024-04-08	Move UserWakeupStore initialization to happen before it is used
e063c26164b7e4603db57cb2adb84b1e7ff67c26	2024-04-04	Intercept intents before applying GWPC policy.
17f1f8aa0ba9e14fa940711393054f386f3d30f5	2024-04-09	Update String resources used for buttons in EditUserInfoController
c8a1fbb5979b78280ce0c3ad1c46a517b1025bf8	2024-04-08	Set the IME control's initiallyVisible to false
67f87795ef4a89fc0c3748b41c950b0ef74db3b7	2024-04-03	Improve the wallpaper crop & rescale logic
beaca7ff0534176cae2831b482ac08f14054b363	2024-04-09	Add log to tell if a provided data stream is read-only or not.
947dcf6e468ace4c9660e290845018da863eb6e4	2024-04-08	[frameworks/Archive] remove all checks for the archiving system property
5acd51ea39d760148301f9a638f5fcbedcdebc63	2024-04-05	[pm] prevent installations of apex packages with permission declarations
c7efda8368b69e92d3f5a4543e9f7b09d8c0c25e	2024-04-09	AccessibilityManager#enableShortcutsForTargets permission adjustment
6628f221474a8bb2a1cdb747cf4b31e7d227d974	2024-04-09	Handle null PFD.
2846c58b16a421ac4d166cbcf94d1e3bb239ab97	2024-04-09	Fix clock/smartspace uses wrong dimension resources in multi-crop preview
5e9e4e31f2e2801e2d92e0c7372d891890b71bdb	2024-04-05	Use static flag instead of impl
3d3366d56bfaa271a9ddd5c4110fcf82c0b6354b	2024-04-09	Remove unused services code
b2fecc4e964050aac62752143c2752ff9e71cbcd	2024-04-10	Always use system config insets types for insets frame
4486fa464361001ce4dc387c81ea692b559aff70	2024-04-10	Fix NPE in DesktopModeWindowDecoration constructor
b02d6cdb30e14fc62ea766300b28cbc741e7604a	2024-04-09	StartActivity in TaskFragments without globalLock held
940ed9ab3109808ef1b709ac9e0e618f09eb1c0b	2024-04-10	[Audiosharing] Avoid fallback device update when onSourceRemoved.
38309661b3732ba511b5880d860d8bcc93dccacf	2024-04-10	refactor(magnification): seperate compute bounds and draw border related logics
4e7fc325ebcf2453f31c1a44894f703acebc9c03	2024-04-08	Restrict app to boundsWithInsets to respect orientation
5ca27bd75288b2d5cb76aee11acf9660f2658f59	2024-04-10	IMMS: Disallow BAL of INPUT_METHOD_SETTINGS via CLIENT_INTENT
db74218a23f70e3d37451a5032c3ccc9cfee2838	2024-04-10	Remove android.security.KeyStore#getInstance()
d0071d27f84e8f7a7c62f8c1a22cc47a9f51cd2c	2024-04-05	Enable biometric virtual sensors separately
13dd0c482ad294baadd4c84e051c9125fce40180	2024-04-05	Fix security vulnerability allowing apps to start from background
c4b105801cd1adf0e215c573c953d46faa82dc9a	2024-04-10	PackageUtils: Use try-with block for DigestInputStream.
f872f6922d36c88595e8fa78f42b53c50eada5d6	2024-04-10	Add proper padding to PerfTestActivity
f5e1da7febf36eba8130f062f7f5a488172888e7	2024-04-03	Update volume slider dragging animation
283e605f4ec7d3e98e22e854da384148ac7d40d5	2024-02-16	Delete flicker datatype objects
f98823a3aa1d31189fcedd05f62d963781e766f3	2023-02-03	Improve `dumpsys backup`
d2c498494671fcf928bcce389f543b77d96080f4	2024-04-04	Adds back hasFlag check for DeviceState toString method
3ebfed1f16087735bd17b6ab3adf6a31a055fedc	2024-04-08	Import translations. DO NOT MERGE ANYWHERE
993574465555f2d0e307416cc2d86a347ad16d58	2024-04-08	Import translations. DO NOT MERGE ANYWHERE
5e612f54e56494401c3cc2b54db50a08998a6469	2024-04-08	Import translations. DO NOT MERGE ANYWHERE
0e981b9bf648e3591e34c6f4a7f6ff5d79059dae	2024-04-08	Import translations. DO NOT MERGE ANYWHERE
3e0bce9bce497f53298aad1823bd219a3e2db09e	2024-04-08	Import translations. DO NOT MERGE ANYWHERE
6b2ea13397a5ecda428e864835f0b7cdb7da87de	2024-04-08	Import translations. DO NOT MERGE ANYWHERE
a709efc8cc56a5408d3463b734f23a2ee5d22ee8	2024-04-08	Import translations. DO NOT MERGE ANYWHERE
c567947185490ac8ddb964d1abd709b9355e7849	2024-04-08	Import translations. DO NOT MERGE ANYWHERE
188a5f1f5736f88d72a8c9672f0b6369c1b595ca	2024-04-08	Import translations. DO NOT MERGE ANYWHERE
2965fdf5a875e6916b4e196f3f637d33fecade9f	2024-04-08	Import translations. DO NOT MERGE ANYWHERE
d68f6d6c89c4e84d4ab8bac81cdb2c9d961079b5	2024-04-08	Import translations. DO NOT MERGE ANYWHERE
a65d92573fc7d50d226c5eeaef5b39c4aed6714a	2024-04-08	Import translations. DO NOT MERGE ANYWHERE
d3599fb94b99508b93100ec13bddd1a5b74d13c7	2024-04-08	Import translations. DO NOT MERGE ANYWHERE
72404f073def93dc85f725d6f7563950cb1ab477	2024-04-08	Import translations. DO NOT MERGE ANYWHERE
bf6041dae590dcc597cd20c8c422bd2830556282	2024-04-08	Import translations. DO NOT MERGE ANYWHERE
57ac178cfb07b38662a8af56b7ed316da2fbd4ca	2024-04-08	Import translations. DO NOT MERGE ANYWHERE
a73d876fb913a0bb5c9fca28d87f2ff4a82e9bfe	2024-04-08	Import translations. DO NOT MERGE ANYWHERE
d992ecbbcad1c53d91ed9c467c66f92db6b6321f	2024-04-08	Import translations. DO NOT MERGE ANYWHERE
a90f3fe9e39856fc97cd5b46c7fd2713ccacf9cc	2024-04-08	Import translations. DO NOT MERGE ANYWHERE
17465a5693384cbb60d2fa203ffe02e3a08e65dd	2024-04-08	Import translations. DO NOT MERGE ANYWHERE
6e67f7d49206325e9f0fd0189b8b3a1c5a2094a8	2024-04-07	[Mobile] Wrap AccessibilityContentDescriptions in a static getter
c409fda93277e2d46fa5cad8e5b2020a4956f85e	2024-04-10	Log the count of force-stop cancelled PendingIntents sent from top.
39ca23bc55484a10461117bd5911d42ad13eebcd	2024-04-10	Do not capture swipes in opposite direction.
8204b65f44f3cbe0ce384ecdfff3a9e66b1bfccd	2024-04-10	Introduce IInputMethodManagerImpl
4dce86fc3e308be7fa8b2768b41ad98f5ef7d138	2024-01-23	Don't force camera shutter sound in India
36951b9734f8fcd4ecddf3a55e1af8f44d86ff5d	2024-03-19	Implement auto-enter PiP2 in gesture nav [4/N]
f4c7e72d8df8781719849bae88210bb1b53f7d30	2024-04-10	Bunlde ClientTransactionItems when enter/exit PiP
42871a378c0effc27840df2f7c548a882c987fce	2024-04-04	Add util methods to validate satellite config data
d2e66ad2b3a1307a922c126b02ca3d195302d6ab	2024-04-11	Update string for device owner package install notification
a9ae219b82d26f77b02c96205e5e3d8d067f1e0d	2024-04-04	Optimize scheduleShowImePostLayout
eb7fea6f33cbefaef78f479cab408650adcac0e1	2024-04-11	Fix NPE in SystemUI
3310a64dda1be0e29400f7db7e9ba314059a5496	2024-04-11	Avoid nested tracing for showImePostLayout
5946a8bfbc924e05dbb4687c73d039f4b0c6b512	2024-04-11	Let BackupRestoreConfirmation opt out edge-to-edge
