673ef97840c0b7bb7c4aadd321b40494f0bd32e8	2023-12-31	[Permissions] Add temporary logging to debug Bluetooth security exception
1c8fcaa8b32a87a43c7051510c0205eeb7fec1c5	2023-11-23	Early return for task-start-position-only change
ebc8588e45f068b2b83add167cb7bc71e5b3acb1	2023-11-23	Add feature flag for content URI permission APIs
bc293813855caa92aa4775b0ac3efabf31d30861	2024-01-02	Add feature flag for content URI permission APIs
b1fa965b53bc3683af74634c46a71acce0509c8f	2024-01-02	Fix an edge case with notification clearing AppOp tests where the notification freshness value overflows and goes negative
290eb22af339d604d20da111909af0076fe241be	2023-11-28	[V][CDM] Replace transport listener and message listener with functional interfaces
8b387a38fa8c10085e9498285e9413369974b99e	2023-12-28	[flexiglass] Adds burn-in to smartspace section elements.
862c7ac14495a28e5fa063a7a35b4f28bf5580a5	2024-01-02	ForceDark: IWYU
46e75da5a1a2f9d53d8a504861436e35849e5c58	2024-01-03	Prepare to make InputMethodSubtypeSwitchingController per-user
896ddc32da780e2e2a54e4136541295e19f7d242	2024-01-03	Mark stylus buttons mapppings as fallback
84853c92567bf817364020b21cede57b26c792ff	2024-01-03	Allow priviledged apps to do cross-package fully trusted embedding.
3ee5dfdcba047051ce81dca0696d6ddfeafe2d98	2024-01-04	Stop marking apps as privileged if they are not signed properly.
2e76468c158ddecbf22ab33c8f525b0e79382ca1	2023-12-22	Always prefer creator over sender to log BalAllowed
46c6066811be1c268b7ebf92a194042619ca9c08	2023-10-03	Fix framework/base/tests for use_resource_processor: true
12a390bf4c4e93fc99d932d68f9e9e01dad901a4	2024-01-04	[Permissions] Add more temporary logging to debug Bluetooth security exception
ec9d305106fdf4ce007baf9b2a1bd0488ebafeea	2024-01-03	Reland "Optimize magnifier viewport drawing"
f1097d7e14bde94a8af79b08f492637495ee2294	2024-01-04	[Permissions] Update AttributionSource.toString to print next field correctly
8ba03525da913327ba66f5f861640c39806bf8f0	2023-12-19	Use measure caches during force layout traversal
339189dcc1dfd002cc642e23cf8e1f82e0b39537	2024-01-04	make Context.setResources() null safe
188b2bdd2623c46f17c316265cde4fdcf9afe59d	2024-01-02	Fix race condition between PromptIconViewBinder and BiometricSizeBinder
c98d65481dcfdddd70127bc339ec6687cf2ce32a	2024-01-04	Add a userId to BOOT_COMPLETED in BroadcastHelper
89e7065c34ca76d4e60b5033f63d4e757480c648	2024-01-04	Update algorithms in SecurityAlgorithmUpdate.java
22a847e70fcc6f1c8e87634095999e5daac22f6d	2023-10-05	Add recovery permission to Settings app
88700bbe2b82edf628fb3e35caada5ec03edf900	2023-12-13	Enforce edge-to-edge policy to apps targeting SDK level 35+
fd8b8d07b3ae8afa87489146124c4d1f34845126	2023-12-15	Don't back up Smooth Display if feature flag off
1400af07f7c5a849bf8115bb1162155b282dd890	2024-01-04	Move onChangeScene and transitions to STLState (1/2)
d91aca44ec53f9b937ef2ee1cab978317a1a3cce	2024-01-05	Introduce MutableSceneTransitionLayoutState
16253de0e32a4522e16812ec98449fe080d7c61e	2024-01-04	Optimise loading wallpaper from disk, by skipping unnecessary steps.
884f3c384b9936c49ebf6c69644a67f9ae8e5c44	2024-01-05	Fix NPE when checking pending transition type
1211fb6703b17f8d420b7386be6c575f3c653374	2023-11-02	Validate package names passed to the installer.
0182732e550f7ef162da621312d60748b98d2841	2023-11-02	Validate package names passed to the installer.
c7fa280e81c26073134c1e2d637d976f808b43ad	2023-11-02	Validate package names passed to the installer.
3da25c89b27be68fb9237d05ee7c6386c4f9d6f1	2023-11-02	Validate package names passed to the installer.
e2be3165b02d5581dadc62b1797e72ecedcc8ddf	2024-01-05	Check whether content providers can be accessed in Pia V2
ed2369639b925847de8163208bc27bbe521e8e07	2024-01-08	Respect the edge-to-edge flags in splash screen window
052b036bfda8e18229b6af1cc57aadce8983485d	2023-12-19	vintf: Disable kernel compat check at boot time.
38fa3c93ee184ce7255e22c4ef6dc76d75903529	2023-12-07	[Sb] Add permissions for satellite_communication
013adabd87347132fa39d4a469efc918d93a3cba	2023-12-21	Inflate handle view as part of expanded view layout
d2a63e18f6b1096e13feedfe496bbe4366a5054a	2024-01-08	Clean component settings while updating an app
b8041b1b95d1663b6f7801f1b92ef7ec67ebada5	2024-01-02	Use launcher app bounds to reset PiP icon overlay
fef32c39697c31d5730e169258c80dd1aa1ade91	2024-01-08	Read-ony transactions may modify TEMP tables
e458428ec5476a14073ecdfb3d96a8e4de5ad50d	2024-01-08	Correct a db perf test
33c0a8866d78200cdec82db04b18e6b7618ddc28	2024-01-08	Revert^2 "Speed up large settings requests."
2f0f93ea9fc856a8af2b2f80dc2f7f422cffd02e	2024-01-09	Support display cutout side override in tests
7575405faabc058f4093ff1659efa5d04a8def91	2024-01-09	Adjust the NetworkRequest configuration used by SecurityController
8f8d72728374160f41538ebad8b800841a4ea58b	2023-12-28	Allow attaching multiple unarchivalListeners to a single session.
fa17ec998dc42c4fd4469ed29bb5b6b59885bb09	2024-01-08	Return false instead of throwing SecurityException for revoked case
3c849f7f33e354d619623946b8ca7bed26882d27	2024-01-09	Only use necessary permissions for wallpaperbackup
9c20028be0b235a02a5d5bea6eb73df60ef45698	2024-01-10	Revert^4 "Speed up large settings requests."
646568df248acfeb49e2c645fa991594e5c74f93	2024-01-09	Correct a SQLite unit test
e48ac5bb09a7b259c937e8f3ff3c0057269e35d4	2024-01-10	Register proxy router after ProxyMediaRouter2Impl has been created
47ad8548925da77d012ea48c6807dbbce124d09f	2023-10-13	fix(high contrast text): draw a solid rectangle background behind text instead of a stroke border
39d525b9b8ff6cf9e3d6f6b8627fbc0807be045d	2024-01-10	Clean up BOUNCER_USER_SWITCHER flag
aefe4a549c25b825904ee3edb8e3d99a87d932ac	2024-01-10	audio service: do not persist system enforced stream volume
9a423550f30aa27f7271a8043950379c49b7dffc	2024-01-09	added resource overlay config_satellite_sim_spn_identifier so the service provider name can be used to identify the network as non-terrestrial.
cca8170d316dc8172a21d6a4b549a012d42c3d37	2023-12-06	surface: Roughly annotate Surface.java with memory usage
efcd54b75118a81c91a426de11f01301cc9d99c3	2023-12-27	SceneGestureHandler renamed gestureWithPriority to currentSource
3678929056b4b0c0b0b95019b5750647cfbd0ff0	2024-01-02	Do not change strong auth for users stopped with delayed locking
2f870bdab227dcb5dcfc077fc13143a2554bcdbb	2024-01-10	[CDM Wear] Fix security issues for Wear
5ab1d831e0967072b79a85d24d0be518e0dffe52	2024-01-11	Clear calling identity when checking if NLS is trusted
ed81c781fa4cc279687caa7c29cc4a7cb750e6b2	2024-01-11	Offer Mockito under Ravenwood.
40e213701b1b32f12935c45cdf8dfdc1a466fe18	2024-01-12	Move From* Interactors to background scope
5f68e65289cbd10dd70edb4cfefc953c5a4d8322	2024-01-11	CSD: Add check to avoid crash when persisting dose records
9fc751342f3a64189a45b9b6305a10a5238aa4cb	2023-11-10	Min and max refresh rate per display (take 2)
a0e0b3b9c0bc3baa82dc24fc96a5675ed7f57f61	2024-01-03	Animate visual indicators between all types.
301113eac35f2dc3efe1bca5d3465a9acdc8ff77	2023-12-18	Make showing percentage texts configurable on shutdown dialog
c60396c0340c8b20779abdd3b9ce0ac513cd9415	2023-12-21	Add keyguard transitions between lockscreen and glanceable hub
c1cb0730047326068b95172acd061fde31785cbb	2024-01-12	Fix for NPE in webview test
b9abcbbd865509375cdebd38b72396989b99964b	2024-01-11	Don't send the boot_completed in the critical path
b85885d750f0eab2d42c61d9f6d7793cee79d560	2024-01-11	[ECM] Make flag fixed (and rename it)
ab085c00a6ec9d6b3db2b2bab0c24b61cfd5e8d6	2024-01-12	Use createForAllProfiles SubscriptionManager
331300d50819d389db7dd726e1c5b611ce1ecf78	2023-12-19	Improve window content change events merging from multiple views
f25a6830a217747dd7e5e34cf94081768284f9c6	2024-01-10	Fix a NPE in PIA if the caller has no requested permissions.
216586f94e345b5d77517292d01163517b02a9a7	2023-11-13	Add WM-side transition trace perfetto tracer
6111289ba84e99323f322ffe0ac8a84e9cd2931f	2024-01-16	Force notifying property callback if DeviceConfig is not updated
7fd409dea29b0ffdfc741d936f8a8a85394bdb0c	2021-11-24	Change Update System Information behavior on receiving Report Physical Address
8dc6feaee7c0a5cea093b5280acaad862921cf3e	2024-01-10	Fix security vulnerability that creates user with no restrictions when accountOptions are too long.
33a90988cf3b59a3b8dc9f699d155688be8d5623	2024-01-10	Fix security vulnerability that creates user with no restrictions when accountOptions are too long.
79f82b24a1abbd5f53b004c7c3f78babf1d48e2c	2024-01-10	Fix security vulnerability that creates user with no restrictions when accountOptions are too long.
7e91582908475af43ff188d9d7e97aea2cdf8ee2	2024-01-10	Fix security vulnerability that creates user with no restrictions when accountOptions are too long.
1c075bf76520d360c55a3b53c3d2e91809eb2a57	2024-01-12	Hide size compat restart button in unfolded fullscreen
28dcae492cc91182e3242a4fb6ef5b65a67637db	2024-01-16	Making adapter child views in RemoteCollectionItemsAdapter size-aware
64868085724364c7483e4e27dda798c48b68c294	2023-12-06	[flexiglass] Add logic to dispatch touches from NSSL to Flexiglass
7b0adf2eec6de98e67baab9d8370e248d1d2f9a0	2024-01-16	Use createForAllProfiles SubscriptionManager
3a614dd98275a9acd5c451442ae7d5d25392020c	2023-11-17	Add the second toggle for the egress data permission on voice activation apps toggle page.
0591c13dd481ce46b7eacc846f504fb61646f69d	2024-01-16	Fix the corner artifacts on UMO on touch ripple and noise.
e18890b56bf14389fcb8a1d654b2a6f0d14280ea	2024-01-16	Use createForAllProfiles SubscriptionManager
94ddf1f02540a130e88698c7cc3f2045a3246b94	2024-01-16	Protect against possible NPE
16736c265e283ef4d722c3fdac40ad9fa0d228ca	2024-01-17	Fix NPEs in AppIdPermissionPolicy.
656c408d2372af6025d7450d6b415ddfd37df939	2024-01-15	Allow BAL permission for UserManagerService
5d4aef88dda464dd4e73bba929fb31cea3d8b7ac	2024-01-17	Force initialize MediaCodec during initializing Tuner to fix flaky cts result
b5d2736c04ab56ee23bdd2225b9c36b0dedeb307	2024-01-17	Opt in ActivityStartInterceptor for BAL
2e3a179e53aa9d8caa62790dab0875ad86d8f6e2	2024-01-17	Correct namespace for frp_enforcement flag.
21cb687595b0414485f016b7589ceeecbb078833	2024-01-17	Update resources on views in QSFooterImpl
5b6153e8e8b03d1b01aaea4bb738eb72c5e820f0	2024-01-17	Evaluate runtime permissions state for their appop
696bd25a702124a9f022969efeb08e40143f8b29	2024-01-17	MISSION UPDATE -- MISSION CONTINUES
723f5086d858fefa3b209394b1361193dd9fb003	2024-01-12	Enforce rounded corners for communal widgets
6c77eb3c7783ee95df3359403bb0d0f1c9e1af77	2023-11-01	Fix deadlock between TRMS lock and Tuner.mLnbLock
d05c0ff623ce7362ad718e51b378805450928fe9	2024-01-09	[SettingsProvider] use per-prefix caches for Config.getStrings queries
cd7f4fada9cd5b3e4be2518b8c6ab6fb4dd95996	2024-01-17	Fix UnlockedDeviceRequired with weak unlock methods
cf93a3a3f55755ed2a5599aed57fa8aaaabfcb7c	2024-01-17	Fix NPEs in {AppId,Package}AppOpPolicy
5991c48af96621d0ff14db7e7a2a4ccfd4e999f8	2024-01-17	[SettingsProvider] fix potential MemoryIntArray leakage
5de953a91afa44c89907827825d3f0e0d5242d86	2024-01-17	Feature Flag for restricting PendingIntents by same UID
0996e608eb82c9d88ab39b00e657614e8d9bb2e0	2024-01-10	Update enums to match ConnectionEvent.aidl and SecurityAlgorithm.aidl
596fa1789c222ab224076b60de470d96865a5d6a	2023-11-10	[res] Optimize name lookups in idmap service
b53da7114e1b1b1970ed692cfd3c2d380a7d2274	2024-01-16	Set flex policy based on job priority.
0dcff8a31fe429af3cabcced2615fec7de15b909	2024-01-17	Revert "Support GNSS configuration overlay from resource"
4ba8795c4830e8e04ac83ef878458885e13ef7e2	2021-06-10	Support GNSS configuration overlay from resource
a9156d61fbfd348ac587e9cc579db2669b571745	2024-01-16	Simplify RemoteInputConnectionImpl#finishComposingText*()
ad212fdbbe99af31cc743d49a5538e3c28751942	2024-01-03	[ToA] Add READ_SYSTEM_GRAMMATICAL_GENDER to privapp-permissions.
f18058bc4e36b49a9e47f59d3ca20ae7d286c165	2024-01-18	Mock Resources in DisplayModeDirectorTest
a640c1645a9c92fa21f04f13ded10a7f12450687	2024-01-11	Baseline Testables updates for Ravenwood.
bca87150b8aae582f63c14ea3b095b7a5b232885	2024-01-18	Revert "Evaluate runtime permissions state for their appop"
b0ed625c7243a01675e0764383c43f9863ed7f91	2024-01-18	Revert "Fix NPEs in {AppId,Package}AppOpPolicy"
8072758750b72432f3f7c34c609e889313d81499	2023-12-01	Pointer Icon Refactor: Load resources for system icons before drawing
7b7b46bc14c65bd75a24af393678ad85bc9dc827	2024-01-17	[Sat] Carrier-based view model + signal
9c88a324c06ebb399c608ce314186b28dd6211fe	2024-01-18	Revert^2 "Fix NPEs in {AppId,Package}AppOpPolicy"
2671bd0de6333e9d30c209b798acea7392bc8a22	2024-01-18	Update NotifIconAreaCtrlr if NICRefactor is off
722cfff0aa9487e2cff343631a318e7f332ec474	2024-01-18	Revert^2 "[SettingsProvider] use per-prefix caches for Config.getStrings queries"
3cecfb160e8322d2c93e3ee9a0f98f977b515c1e	2024-01-17	[flexiglass] Prevent unintentional switching to the Gone scene.
f7bfbc3490bf66fd8c4dce7cad7de0fd7c6cca70	2024-01-19	New PermissionsChangedFlow
b01504da752c9696961d6ccf146a3504477591ba	2024-01-19	Log exception when MediaPlayer.attemptDataSource fails
aece46c8b0b21263f81d65d60133ab309f9556bc	2024-01-10	Add privapp permissions for DeviceDiagnostics
ac74a023f2807f6474a07cb63c8f4cdf83f871df	2024-01-19	Report multiple in-process primary connections
5f9a0abdebf963b2fe76e8b2c73bebe700960e65	2023-12-18	Don't rush job checking at boot.
526804c7e6e3f20b1d0b9a8bdc1d68dc7c31d62f	2024-01-22	Fix NPE in MR2ServiceImpl#checkArgumentsForSessionControl
e0b419960b8a850fe02d36af954711c4a1310e6c	2024-01-17	Check permission of the calling process
07a30c911c6f7f70551bb13c189bad8c01d07c26	2023-11-22	ASM Rule and Debug Updates.
62ee3bce39dc82aaa49f6582cb12e92ad5ea95cd	2024-01-10	Add signature permission allowlist.
fdd85af98764164dcd66f22fa60a8fce4271fad7	2024-01-22	Pass the correct user ID to SetProcessProfilesCached()
37d64fa5ed0655fa3329f1d71583f2d42745fe41	2024-01-22	LockPatternUtilsTest: use dependency injection for ILockSettings
8750ab191547cb398d25fd96193fbe7a250c4c27	2024-01-22	LockPatternUtilsTest: don't call the real TrustManagerService
843503ba07542b3b46e936855c006b15324cf71e	2024-01-22	Merge together the two LockPatternUtilsTest
c31dd7f5ba1ca7e351f47ce4bb53fc2a9f333fc7	2024-01-22	Don't throw exception when changing unrequested permission state.
f30fff25d182249ee2ee347d5cd0f89c75576817	2023-11-10	[res] Optimize idmap data initialization in OMS
820f9d71d4292706a4550bd29131c556aea473f6	2024-01-19	Synchronize access to BatteryStatsHistory
1fdb9f60cdb9c423942460aca438cd3460be1022	2024-01-22	[pm] fix a system crash caused by cleanUpUser
83f77092cef382bf3bdcbeb940def821ba63d3bc	2024-01-18	Provide error handling for nullptr in the ADPF NDK
3a13332728d6da17dc7434adc0decae704f19396	2024-01-22	Avoid NPE crash system server
32d06ea0733f9699b6dc32f380bd13a566a94592	2024-01-22	On TVs, disable "skip next routing control" flag after a short delay
5bc6a51ad47a87d4f4ac78f1cabda211f02ea8bc	2024-01-23	Set upper limit of process queue in MainContentCaptureSessionV2
24c38549bb98a7e5a7ba4ae2f6d09c778d8eb9d4	2024-01-23	Delay handler messages until class is fully initialized
325b0aff231401f09a46f0f411eacc1cb0805f48	2024-01-23	Fix memory leak where SC for drag is never released
dd4e1a8502b74f5aa0164f5066c317b351f86202	2024-01-22	Pass the correct user ID to SetProcessProfilesCached()
1e7bed2a343559e21730564383eaa27337844894	2024-01-23	Don't allowlist on BOOT_COMPLETED for unstop
3406b5f1f7191cd94c0f41a99c1fe6dc3fc746af	2024-01-22	Pass the correct user ID to SetProcessProfilesCached()
98f87e7d9fdcb2042009da2324a93807fb64ce42	2024-01-18	Add mSideHint to InsetsSource
c9d4fdeb53e6ce13bb46c2197c1a57c40498d54b	2024-01-24	Fix launch animation for PrivacyDialog and reenable dismiss anim
027afce10b6a3afd0805b96484cf7481430ef5d8	2024-01-24	Fix BadParcelableException when transferInitiatorUserHandle is null
c04d218ef175eae2229246e75bd8b18e6343b181	2024-01-23	Fix wallpaper dim logic
c78e8c3cada1a84ef2fae1b6826a3a5c92a11d05	2024-01-24	Fix NPEs in DevicePermissionPolicy.
85f3b428ab35b18384f2e1bc31a07c6c2d5b30d7	2024-01-05	Allow the phone app to update safety center
d74605a625daaedd3dca2c6f5f127135d4cc16a6	2024-01-24	Create RemoteViews Factory Container
e513df86ee50f3a2cae79f47579a3e5b05d0b2ec	2024-01-12	Add CUJ_BACK_PANEL_ARROW for tracking jank
0b97dd90d69731d2cfff5b054a1291751aa2e26f	2024-01-18	[ECM] Start EnhancedConfirmationService in SS
71ced8ff7826df722aaaca77916c6996bc894592	2024-01-22	[pm] fix NPE in PreferredComponent
fa28ce36c675eb8853a8b788cb2623bc266bee24	2024-01-15	[2/n] Add configurable font_scale
12dc2b8a9fff3defe3348d9af16fef2f5fa5d7b9	2024-01-24	[aapt2] Always generate code for permissions
dab71a3a5750782320bb1bb8b2ef19624acacbcc	2024-01-23	Replace swipe Edge (detector) by SwipeSource (detector) (1/2)
78703ead41cb25df56da891c58b3d549373759e7	2024-01-24	Enforce that onDragStarted.overSlop is != 0f
19c1ef31feb82ad780bbbc78d81dd24a3df57489	2024-01-25	Fix provide wrong resources when check isOnBackInvokedCallbackEnabled
9069f016f06415a2bb25920f9360ea39a8d0b66b	2024-01-25	Revert "Improve ImageFloatingTextView Tracing"
2c68aa6bc7d30124fd27a1d00508722823e1768e	2023-03-31	Keystore: Validate curve names in XDH and ED25519
57e26739191fa4d74a2bf23c5361a2724fbb638f	2024-01-25	HDMI: TV should ignore <Standby> from non-AS devices
00b42270996d35bd46b8c61cc1765aaf8394d76a	2024-01-24	HDMI: Ignore <Routing Information> with PA equal to sender's PA
653ac0cdc7fb5e96a73eed3066f84abf432ba22c	2024-01-25	Revert "Keystore: Validate curve names in XDH and ED25519"
418a1071588b5838943c9a5ae064e8f09d8e2be4	2024-01-25	CSD: Quick fix for dose record sanitization
0680d68fc6c3ffff78c1ee09fa45393992a9b32d	2024-01-25	Work around NPE in onPackageUninstalled().
62a6812853ad8179f4d2daf6f3c445cdcceaf377	2024-01-25	[ECM] Declare MANAGE_ENHANCED_CONFIRMATION_STATES permission
e69181292e7c7684a513b95b701b181273f4179f	2024-01-20	[DeviceAware] Use correct device id in Context and Context#mAttributionSource fields
fe012c183dd4d031e87c15d3d6f7b3b9653a9670	2024-01-25	Suppress compose compiler error for default value
a43405594a4a3e5e30515da91dd5e4f6cd564b5e	2023-12-08	fix(force invert): cache force dark setting
50cfcf9c4ecce255f9205339933440b2c892e34b	2024-01-25	Update keyguard flow to always be on main thread.
ac9016aaf7f06e98d139fb1bfcd6d022cc41f2b4	2024-01-26	Fix regression in SceneGestureHandler
abbaa445ea424d2cb0eae3b267fee154ab03f4fe	2024-01-26	Revert^2 "Keystore: Validate curve names in XDH and ED25519"
e5c48c9025cfec2e727caf522df29c91cfdf74fc	2024-01-24	Don't always intercept swipe transitions
a718863cd3bade514ebdf8f478ac11ffff207b89	2023-12-07	Add a new MMS result code for large MMS denial over satellite
fdda7b485b0d12f9a9be618b9870e0b9e012756a	2024-01-25	Cleanup hub disabled flow by consolidating logic
b6e47ce9c3346207818d8e4fcc14b3d9c3f97669	2024-01-24	Return full bubble bar bounds on display when expanded
0a2bba4a18638a9d2778fe1521e8063ad87b91b2	2024-01-08	Add a new exemption for backup-related jobs.
22175211bc4efad34644e4bb2df8efa387261ea9	2024-01-27	Do not mutate mDragStartTaskBounds during drag-resize
dc890d9d7db70ee2c69241c8c312b259489fb34e	2024-01-27	Fix NPE when referencing DragResizeInputListener
06775341ad7d77410798f95117cbee7a1a02c201	2024-01-04	Stop marking apps as privileged if they are not signed properly.
bae00621c4c00f7ba6ad99133c3dfb3430751e14	2024-01-15	[flexiglass] Force garbage collection after successful authentication.
d170ec5f09891b60c338aba49ac527b944283257	2024-01-29	Fix NPE in FoldableDeviceStateProvider
0127da5b11c7f67a745f96839ce28a9371fc528c	2024-01-04	Stop marking apps as privileged if they are not signed properly.
e336c7d7c9ceb49d934bbef0d27ecef344ad80ed	2024-01-04	Stop marking apps as privileged if they are not signed properly.
e1dc10583bcf701a583485c0bd596b1d0d8f88e0	2024-01-27	Cancel veil animations on dispose
37ede2019d2d245c2de2c9bf049526a108cf33ce	2024-01-04	Stop marking apps as privileged if they are not signed properly.
052287a595326cf1ce3f901f5a5c6d9f961d698f	2024-01-29	Revert "Fix User Switch Timeout Issue"
6c23a59305e1a0435d1c5761749017866a4f5772	2024-01-29	Avoid NPE when trying to unlock user with wrong token handle
a00f801be109b3cd55d3f54db940ac6aed6b050e	2024-01-17	Communal profile is always keyguard-unlocked
dc49337e87729fd5a3d3fea97e257b205df1c7ac	2024-01-29	Revert "Fix User Switch Timeout Issue"
184d074543f2a0dc8347a9d44f4fe57b780948f9	2024-01-29	Support null service resources in ServiceWatcher
7847bc0c897f30f89c59a714b711461bfeed6d4b	2024-01-29	Use decor's TaskInfo instead of ShellTaskOrganizer's
e989512249df69184209d4968037a3969ae5d091	2024-01-29	Add config for OEM to define CredMan UI activity replacement
c16ee008094a2e5bb381264a29a71bb36ef00d10	2024-01-29	Revert "Fix User Switch Timeout Issue"
b342d8fe49a13d7e0529613d4925d4661ebb6680	2024-01-30	Update enforce intent filter match implementation
ec914ad7bd593029542163aca44768ae49ae0962	2024-01-18	Add a binder cache to UiModeManager#getNightMode
94c26929f5c8283ac7087c56a2e08320dd24770a	2024-01-30	Added resources for system notification for satellite service
6a9ebce1762f53e635f8c1d03d15da3b4aa7bfdf	2024-01-29	Force update the surface of opening targets to visible
ff3432dacf83724862049652212268bbb54630fe	2024-01-03	Upgrade body sensors background permission in V
b90aef7bd7890208535d970e8cc296fd82d54741	2024-01-29	Update decor insets by checking frame of all insets sources
8ab8c7517905915808491506f634b808618fb706	2024-01-30	Revert^2 "Revert "Fix vulnerability in AttributionSource due to in..."
05072e229460c1ec87239fbdbb8127cabcab444c	2024-01-30	Don't disable APIs which ensure the contrast of system bars
cbf70c0b66d18bf6decf0dc61ee958d3702622c3	2024-01-30	Handle NPE for toolType update with hardware keyboard
8d498deb2bd7d02d20873bd09b998715d1c638da	2024-01-26	Add CredentialScreenChip and string resources
030bfe15776f000777e8a016f174ec9011bd9bf6	2024-01-30	Update description of FSI behavior
fe289013d037f7b4e088d6b6acc2c11f212ac2b8	2024-01-11	Use android::os::InputChannelCore for parceling InputChannel
449d9b5a732f5a4ed291ab9dd5dc6ca3cd0eff90	2024-01-25	If the app bubble is in the overflow, use that instead of recreating
4aca6fabe8e2d6ce72f94735c6a5f0e70474bfc0	2023-10-12	Fix: IMEs don't receive onUpdateSelection when performs insertion mode
7c19b3cc10b662ecf42561f1013ecb5b53cd46c3	2024-01-29	[res] Speed up a check of a resource name for int
aa441f5ebff7a8670a542b907c196fc9758afbde	2024-01-30	Remove the scaling code
6e4519c987fb5885df476402a8fdb992c1bf5cef	2024-01-26	Don't use product specific resources
1ed8016f55a6f4bd4e276816d251ed0c116f3638	2024-01-31	Update OWNERS for core/java/android/security
f9ead631cc66fdc86c44acc985a84dbab12c7844	2024-01-31	Add feature flag for ASL-in-APK app meta data source
1f7f5d2bffdf6ae055d76c10812ad6a8d8f35abb	2024-01-26	notification: fix Alarm & PendingIntent leak
86791cac9a6b74b6f67cb92b9487717ec2bde08d	2024-01-31	Add deviceId to AttributionSource#toString
922c54c427157ac3f41e4d163a5c51252388159f	2024-01-30	[flexiglass] FRP support.
751ea275ead3d7b4a8434b15ecaa39c1e7957c82	2024-01-29	Show real installerTitle for the unarchive permission dialog.
cd0649084237ff9f8e04738b9b43ad0457d7e6dd	2024-01-15	Partial Screenshare Opt-Out Override
936ea61036f3f8118b491b113f6f823e8b7aeb1c	2024-01-24	Update transitionInterceptionThreshold whenever there is a new value
ddc9c66bf01214698334ef47e5fb71782a41ad5b	2024-01-30	[Vulkan] Utilize Skia's new VK_ERROR_DEVICE_LOST callback to log
bd8d965378efd80ea89c7cae284d2b28092c921d	2024-01-31	Revert "Delay handler messages until class is fully initialized"
08f5d1bc4cf1c5bd5229f8895e36d47e17622f9b	2024-01-31	Revert "PointerController: Simplify display info listener registration"
bd937026f1a81e48208ff4e18e2a663c26854d21	2024-01-31	Revert "PointerController: Get initial DisplayInfos from SurfaceComposerClient"
691fe6a145a1b87282c7f5abba04432eb2ebba05	2024-01-30	Fix touch handling for glanceable hub over dream
0baee10f531b8560f2591f6170ddb2aaffed4e2a	2024-01-24	Update interception for archived apps in ActivityStarter to abort bundle options and cancel remote animations during unarchival.
2f1c20236a39b43bfec0c3d90f02c90f25d475b7	2024-01-31	Make VirtualAudioDevice device-aware
fb4b51c58b1be4406cba3e42f5bcbd637f23a0d0	2024-01-31	Fix NPE when removing widgets
dd4f1b0ef44ea959591e502d5d14dc72ce872e19	2024-02-01	[sqlite] Fix docs typo
17d455bbcf1f0e1f8edb763b4a8f45efb984abdd	2024-01-31	Add WRITE_VERIFICATION_STATE_E2EE_CONTACT_KEYS to Shell.
bad132df69d931cdc8fb9eda45367f8fedbc0ec9	2023-12-13	Adjust process state for visible overlay window
f002f79b274c57d59a65c7b875ac0a4f22cee0db	2024-01-31	Add test for tracing onFlush()
bdb6c422e9d8ca09dbd5cadcd6298aa5c3a44a83	2024-01-25	Call setFrameRate in TextureView to set frame rate properly.
15a2c1e3eee4a89921a8d37b18942ea713c36773	2024-01-27	Move DragAndDropController to the handheld WMShellModule
8289cf5012480d75d5a7503cfcc7afbd5977139c	2024-01-29	Address review comments for dispatch audio focus with fade API
15620b01e7bde81bf9f36172eb01d235052b1146	2023-10-12	Support per-process useEmbeddedDex opt-in
6fc4d0c91f52f1fd1cc946829c4d650fdc4d3268	2024-01-24	Suppress HUNs after avalanche, with allowlist
e0ea094b68ed1e305b1b57ed7df9aa9f2aa8dc25	2024-02-01	[res] Fix a crash in dumpHistory() when impl==null
513e18c3722bff3a72b5bc1f29fd8d331b32aff6	2024-02-01	Fix ScrimControllerTest memory leak
76c3b4f06e5c7e01a543e7ec7c7c804738881bdc	2024-01-22	Update batching logic.
37c6cf93b02ebcbfff901a521de6c022999bf946	2024-02-01	Rotate cutout to ROTATION_0 when getting metrics for natural rotation
33e518094d947ad50dd31c545f3362eb9576a027	2023-07-27	Fix type inference errors with kotlinc 1.9.0
cfe9107604db01cbd8602da114cbeb3ed6487a74	2024-02-01	Updates event source to important parent only when events are merged
4554f21546795967db58bf0eabbacadaf97ca1dc	2024-01-26	Add small delay to animate device entry unlock icon
